{
  "$id": "https://w3id.org/sc-referee/schema/v0.12.0/detector-qualification.schema.json",
  "$schema": "https://json-schema.org/draft/2020-12/schema",
  "additionalProperties": false,
  "allOf": [
    {
      "if": {
        "properties": {
          "review_basis": {
            "const": "agent_panel"
          }
        },
        "required": [
          "review_basis"
        ]
      },
      "then": {
        "properties": {
          "agent_adjudication_refs": {
            "minItems": 1
          },
          "human_scientific_approvals": {
            "maxItems": 0
          }
        }
      }
    },
    {
      "if": {
        "properties": {
          "review_basis": {
            "const": "mixed_panel"
          }
        },
        "required": [
          "review_basis"
        ]
      },
      "then": {
        "properties": {
          "agent_adjudication_refs": {
            "minItems": 1
          },
          "human_scientific_approvals": {
            "minItems": 1
          }
        }
      }
    },
    {
      "if": {
        "properties": {
          "review_basis": {
            "const": "human_panel"
          }
        },
        "required": [
          "review_basis"
        ]
      },
      "then": {
        "properties": {
          "agent_adjudication_refs": {
            "maxItems": 0
          },
          "human_scientific_approvals": {
            "minItems": 1
          }
        }
      }
    },
    {
      "if": {
        "properties": {
          "review_basis": {
            "enum": [
              "agent_panel",
              "mixed_panel"
            ]
          }
        },
        "required": [
          "review_basis"
        ]
      },
      "then": {
        "properties": {
          "agent_adjudication_refs": {
            "minItems": 1
          }
        }
      }
    },
    {
      "if": {
        "properties": {
          "outcome": {
            "const": "promoted"
          },
          "requested_maturity": {
            "enum": [
              "validated",
              "publication_grade"
            ]
          }
        },
        "required": [
          "requested_maturity",
          "outcome"
        ]
      },
      "then": {
        "properties": {
          "agent_adjudication_refs": {
            "minItems": 1
          },
          "review_basis": {
            "enum": [
              "agent_panel",
              "mixed_panel"
            ]
          },
          "safety_gates": {
            "properties": {
              "cluster_aware_uncertainty_reported": {
                "const": true
              },
              "conditional_never_promoted": {
                "const": true
              },
              "decisive_counterevidence_included": {
                "const": true
              },
              "no_known_high_or_critical_false_accusations": {
                "const": true
              },
              "public_development_cases_not_used_for_qualification": {
                "const": true
              },
              "qualification_report_public": {
                "const": true
              },
              "regression_fixture_for_every_discovered_false_accusation": {
                "const": true
              },
              "unresolved_disagreement_excluded": {
                "const": true
              },
              "verified_good_and_hard_negative_included": {
                "const": true
              }
            }
          }
        }
      }
    },
    {
      "if": {
        "properties": {
          "outcome": {
            "const": "promoted"
          },
          "requested_maturity": {
            "const": "publication_grade"
          }
        },
        "required": [
          "requested_maturity",
          "outcome"
        ]
      },
      "then": {
        "properties": {
          "agent_adjudication_refs": {
            "minItems": 2
          },
          "independent_corpus_refs": {
            "minItems": 1
          },
          "review_basis": {
            "enum": [
              "agent_panel",
              "mixed_panel"
            ]
          }
        },
        "required": [
          "independent_corpus_refs"
        ]
      }
    },
    {
      "if": {
        "properties": {
          "outcome": {
            "const": "promoted"
          },
          "requested_maturity": {
            "const": "validated"
          }
        },
        "required": [
          "requested_maturity",
          "outcome"
        ]
      },
      "then": {
        "properties": {
          "effective_maturity": {
            "const": "validated"
          }
        }
      }
    },
    {
      "if": {
        "properties": {
          "outcome": {
            "const": "promoted"
          },
          "requested_maturity": {
            "const": "publication_grade"
          }
        },
        "required": [
          "requested_maturity",
          "outcome"
        ]
      },
      "then": {
        "properties": {
          "effective_maturity": {
            "const": "publication_grade"
          }
        }
      }
    },
    {
      "if": {
        "properties": {
          "numeric_threshold_policy": {
            "const": "deferred_until_pilot_threshold_adr"
          }
        },
        "required": [
          "numeric_threshold_policy"
        ]
      },
      "then": {
        "properties": {
          "outcome": {
            "not": {
              "const": "promoted"
            }
          }
        }
      }
    }
  ],
  "properties": {
    "agent_adjudication_refs": {
      "items": {
        "$ref": "https://w3id.org/sc-referee/schema/v0.12.0/common.schema.json#/$defs/RecordRef"
      },
      "minItems": 0,
      "type": "array",
      "uniqueItems": true
    },
    "author_actor_ids": {
      "items": {
        "$ref": "https://w3id.org/sc-referee/schema/v0.12.0/common.schema.json#/$defs/Identifier"
      },
      "minItems": 1,
      "type": "array",
      "uniqueItems": true
    },
    "decided_at": {
      "$ref": "https://w3id.org/sc-referee/schema/v0.12.0/common.schema.json#/$defs/Timestamp"
    },
    "detector_id": {
      "$ref": "https://w3id.org/sc-referee/schema/v0.12.0/common.schema.json#/$defs/Identifier"
    },
    "detector_version": {
      "$ref": "https://w3id.org/sc-referee/schema/v0.12.0/common.schema.json#/$defs/SemVer"
    },
    "effective_maturity": {
      "$ref": "https://w3id.org/sc-referee/schema/v0.12.0/common.schema.json#/$defs/Maturity"
    },
    "evaluation_refs": {
      "items": {
        "minLength": 1,
        "type": "string"
      },
      "minItems": 1,
      "type": "array",
      "uniqueItems": true
    },
    "extensions": {
      "additionalProperties": true,
      "type": "object"
    },
    "human_scientific_approvals": {
      "items": {
        "additionalProperties": false,
        "properties": {
          "domain_expertise": {
            "items": {
              "minLength": 1,
              "type": "string"
            },
            "minItems": 1,
            "type": "array"
          },
          "independent_of_author": {
            "const": true
          },
          "reviewer": {
            "$ref": "https://w3id.org/sc-referee/schema/v0.12.0/common.schema.json#/$defs/Actor"
          }
        },
        "required": [
          "reviewer",
          "independent_of_author",
          "domain_expertise"
        ],
        "type": "object"
      },
      "minItems": 0,
      "type": "array"
    },
    "independent_corpus_refs": {
      "items": {
        "minLength": 1,
        "type": "string"
      },
      "minItems": 0,
      "type": "array",
      "uniqueItems": true
    },
    "numeric_threshold_policy": {
      "const": "deferred_until_pilot_threshold_adr"
    },
    "outcome": {
      "enum": [
        "promoted",
        "retained",
        "rejected",
        "deferred",
        "demoted"
      ]
    },
    "provenance": {
      "$ref": "https://w3id.org/sc-referee/schema/v0.12.0/common.schema.json#/$defs/Provenance"
    },
    "qualification_basis_disclosure": {
      "minLength": 1,
      "type": "string"
    },
    "qualification_id": {
      "$ref": "https://w3id.org/sc-referee/schema/v0.12.0/common.schema.json#/$defs/Identifier"
    },
    "qualification_report_ref": {
      "minLength": 1,
      "type": "string"
    },
    "quantitative_metrics": {
      "oneOf": [
        {
          "type": "null"
        },
        {
          "additionalProperties": false,
          "properties": {
            "metric_profile": {
              "const": "root-cause-clustered-metrics-v1"
            },
            "metric_set_refs": {
              "items": {
                "additionalProperties": false,
                "properties": {
                  "record_id": {
                    "$ref": "https://w3id.org/sc-referee/schema/v0.12.0/common.schema.json#/$defs/Identifier"
                  },
                  "record_type": {
                    "const": "qualification_metric_set"
                  }
                },
                "required": [
                  "record_type",
                  "record_id"
                ],
                "type": "object"
              },
              "minItems": 1,
              "type": "array",
              "uniqueItems": true
            }
          },
          "required": [
            "metric_profile",
            "metric_set_refs"
          ],
          "type": "object"
        }
      ]
    },
    "record_type": {
      "const": "detector_qualification"
    },
    "requested_maturity": {
      "$ref": "https://w3id.org/sc-referee/schema/v0.12.0/common.schema.json#/$defs/Maturity"
    },
    "review_basis": {
      "enum": [
        "agent_panel",
        "mixed_panel",
        "human_panel"
      ]
    },
    "reviewer_disagreement": {
      "type": [
        "string",
        "null"
      ]
    },
    "safety_gates": {
      "additionalProperties": false,
      "properties": {
        "cluster_aware_uncertainty_reported": {
          "type": "boolean"
        },
        "conditional_never_promoted": {
          "type": "boolean"
        },
        "decisive_counterevidence_included": {
          "type": "boolean"
        },
        "no_known_high_or_critical_false_accusations": {
          "type": "boolean"
        },
        "public_development_cases_not_used_for_qualification": {
          "type": "boolean"
        },
        "qualification_report_public": {
          "type": "boolean"
        },
        "regression_fixture_for_every_discovered_false_accusation": {
          "type": "boolean"
        },
        "unresolved_disagreement_excluded": {
          "type": "boolean"
        },
        "verified_good_and_hard_negative_included": {
          "type": "boolean"
        }
      },
      "required": [
        "no_known_high_or_critical_false_accusations",
        "conditional_never_promoted",
        "verified_good_and_hard_negative_included",
        "decisive_counterevidence_included",
        "cluster_aware_uncertainty_reported",
        "public_development_cases_not_used_for_qualification",
        "regression_fixture_for_every_discovered_false_accusation",
        "unresolved_disagreement_excluded",
        "qualification_report_public"
      ],
      "type": "object"
    },
    "schema_version": {
      "$ref": "https://w3id.org/sc-referee/schema/v0.12.0/common.schema.json#/$defs/SchemaVersion"
    },
    "software_maintainer_approvals": {
      "items": {
        "$ref": "https://w3id.org/sc-referee/schema/v0.12.0/common.schema.json#/$defs/Actor"
      },
      "minItems": 1,
      "type": "array"
    }
  },
  "required": [
    "schema_version",
    "record_type",
    "qualification_id",
    "detector_id",
    "detector_version",
    "requested_maturity",
    "outcome",
    "effective_maturity",
    "software_maintainer_approvals",
    "review_basis",
    "agent_adjudication_refs",
    "human_scientific_approvals",
    "author_actor_ids",
    "qualification_report_ref",
    "evaluation_refs",
    "safety_gates",
    "numeric_threshold_policy",
    "qualification_basis_disclosure",
    "decided_at",
    "provenance"
  ],
  "title": "sc-referee Detector Qualification",
  "type": "object"
}
