{
  "schema_version": "0.5.0",
  "record_type": "detector_qualification",
  "qualification_id": "qualification:claim-sign-v1",
  "detector_id": "detector:claim-sign",
  "detector_version": "1.0.0",
  "requested_maturity": "validated",
  "outcome": "promoted",
  "effective_maturity": "validated",
  "software_maintainer_approvals": [
    {
      "actor_kind": "human",
      "actor_id": "person:maintainer-1",
      "display_name": "Maintainer One"
    }
  ],
  "review_basis": "agent_panel",
  "agent_adjudication_refs": [
    {
      "record_type": "benchmark_adjudication",
      "record_id": "benchmark-adjudication:claim-sign-heldout"
    }
  ],
  "human_scientific_approvals": [],
  "author_actor_ids": [
    "person:author-1"
  ],
  "qualification_report_ref": "qualification/claim-sign-v1.md",
  "evaluation_refs": [
    "evaluation:claim-sign-heldout"
  ],
  "independent_corpus_refs": [],
  "safety_gates": {
    "no_known_high_or_critical_false_accusations": true,
    "conditional_never_promoted": true,
    "verified_good_and_hard_negative_included": true,
    "decisive_counterevidence_included": true,
    "cluster_aware_uncertainty_reported": true,
    "public_development_cases_not_used_for_qualification": true,
    "regression_fixture_for_every_discovered_false_accusation": true,
    "unresolved_disagreement_excluded": true,
    "qualification_report_public": true
  },
  "quantitative_metrics": null,
  "numeric_threshold_policy": "deferred_until_pilot_threshold_adr",
  "qualification_basis_disclosure": "Validated using a pinned cross-provider agent panel; no human scientific approval is claimed.",
  "reviewer_disagreement": null,
  "decided_at": "2026-07-27T20:00:00Z",
  "provenance": {
    "actor": {
      "actor_kind": "controller",
      "actor_id": "software:sc-referee-eval",
      "display_name": "sc-referee evaluation controller"
    },
    "method": "deterministic_evaluation_runner",
    "created_at": "2026-07-27T18:00:00Z",
    "tool": "sc-referee-eval",
    "tool_version": "0.5.0"
  }
}
